title,location,company,summary,salary
Graduate Software Engineer (London),Amsterdam Zuid,Optiver,"Working together, our traders and software engineers design proprietary systems and execute strategies to provide liquidity and increase market efficiencies.",
Software Engineer,Rotterdam,Equalture,We are looking for a software engineer to help us scale and optimize our infrastructure.You mentor other engineers and enjoy learning from one another.,€3.000 - €4.500 per maand
EU Software Developer,Tilburg,Tesla,"Collaborate with other cross-functional teams such as product managers, quality engineers and release engineers to own your solution from start to deployment.",
"Lead Software Engineer, Back-End",Amsterdam,Everon,Your software will handle load balancing and interoperability with roaming partners.Experience in engineering low latency software systems of medium to large…,
Junior API Integration Engineer-Netherlands,Amsterdam Centrum,Enterprise Bot,"At Enterprise Bot, we create AI-powered bots to automate customer interactions and provide enterprises with a readily accessible digital agent to improve…",
"Deep Learning Research Engineer (Qualcomm Research, Amsterda...",Amsterdam,Qualcomm Technologies Netherlands B.V.,"As a Deep Learning Researcher at Qualcomm, your role involves testing hypotheses, quickly iterating on promising ideas, and prototyping and implementing these…",
Autopilot Software QA Engineer,Amsterdam,Tesla,"Experience troubleshooting on both software and hardware level.3+ years of experience testing automotive or robotic systems, vehicle dynamics, embedded or…",
Software Engineer - Email Automation,Amsterdam,WeTransfer,"At the moment the team consists of a mix data engineers and scientist, full stack engineers and email experts.Full-time / Part-time · Amsterdam.",
Senior Software Engineer,Amsterdam,Tommy Hilfiger,"Tools: software containerization (Docker), GitLab, Swagger.The Technology team aims to become driving force in the organization for technology strategies &…",
Experienced C# Engineer,Nootdorp,Fugro,Agile and passionate about software engineering;You will participate in software design targeting cloud environment.Knowledge of XAML and WPF is useful;,
Principal Software Engineer,Schiphol,Liberty Global,"Support and develop software engineers by providing advice, coaching and educational opportunities.Liberty Global is one of the world’s leading converged video…",
Software Engineer - New Grad 2021 (Amsterdam),Amsterdam,Databricks,"We are hiring software engineers who are passionate about architecting, developing, deploying, and operating the Databricks product.",
Software Test Engineer,Rotterdam,Science [&] Technology Corporation,"Knowledge with data processing algorithms, control software and operating systems.Together with various stakeholders, they develop, test, integrate and qualify…",
Websphere Engineer,Utrecht,Rabobank,You have general knowledge of software development and knowledge of the business domain that you work for.Imagine… with your DevOps team you are managing the…,
Simulation Engineer,Nederland,INCONTROL Simulation Solutions,Provide user support our software users.Support our project engineers & consultants in client meetings.Are you ready to solve diverse logistic puzzles using…,
Python Software Engineer,Amsterdam,iBOOD,Experience with Agile software development methodologies.Writing (unit/integration) tests and improving the quality of our software.,€40 per uur
"Senior Software Engineer, Back-End",Amsterdam,Everon,"Experience in engineering low latency software systems of medium to large scope and complexity.At Everon, we make expansion into EV charging easy and…",
Software Engineer: Public API,Amsterdam,Digital Ocean Jobs,We are looking for engineers to join our API Engineering team.We believe that today's entrepreneurs are changing the world through software.,
Software Engineer,Woerden,Flex,Design and document software architectures.As part of an international team you focus on the embedded software development aspects of our hardware designs.,
Software Engineer,Boxmeer,Marel,"We are looking for software engineers, with background in developing enterprise software to join our growing Innova software team.",
Software Engineer,Delft,Baker Hughes,"Have experience with scaled Scrum/Agile software development.The JewelEarth software platform provides (API) services, user interface components, domain…",
Full Stack Engineer,Amsterdam,Amberscript,We are building SaaS software that enables users to automatically transcribe audio & video into text using speech recognition.,
DevOps engineer,Amsterdam,BESTSELLER,"We are software engineers, delivering a platform that drives innovation.Engage in service capacity planning, demand forecasting, software performance analysis…",
"Senior Solution Engineer - SD-WAN EMEA (Dell) Utrecht, Utrec...",Utrecht,VMware,"We look beyond the barriers of compromise to engineer new ways to make technologies work together seamlessly.These include, but are not limited to, Executives,…",
Internship - Junior Software Engineer,Amsterdam,Finaps,"Experience with commercial software development is a plus.Our young, impassioned and ambitious business engineers work in close collaboration with our clients…",
Cyber Security Engineer - Token ID - Level 4,Rotterdam,Visa,"Fascinated by the future and captivated by technology?Smart, driven and want to make a difference in the world?You’ll fit right in.What’s it all about?",
Embedded Software Engineer,Amsterdam Westpoort,Avy,Our systems require high quality avionics and reliable software.You have proven track record in embedded software development and troubleshooting.,
Junior Software Engineer (32-40 hours/week),Amersfoort,Cablon Medical B.V.,Do you want to help hospitals worldwide meet high quality standard through cloud based software?Cablon Medical delivers all kinds of software and hardware to…,
.NET Software Engineer | Defensie | Nato | Europol | NFI,Randstad,Hello Developers World,Omdat er vereist is dat de software van de hoogste kwaliteit moet zijn zorgt jouw nieuwe werkgever er ook voor dat je op het juiste niveau zit door bijvoorbeeld…,€3.000 - €6.000 per maand
Embedded Software Design Engineer,Veldhoven,ASML,Defining software and integration tests to qualify the new software;Embedded software in combination with related hardware;You’d better contact us today!,
Graduate Software Engineer,Amsterdam,Adyen,"Our engineers are responsible for the full development cycle, from designing software to testing and deploying it in a weekly release.",
"Software Development Engineer Internship – 2021 (Amsterdam,...",Amsterdam,Amzn Dev Ctr (Netherlands) B.V,Our interns write real software and collaborate with a selected group of experienced software development engineers who help interns on projects that matter to…,
Mechanical Engineer (R&D),Hengelo OV,Howden Netherlands B.V.,"Ervaring met technische software zoals MATLAB;Howden is marktleider in ventilatoren, warmtewisselaars en compressoren, met toepassingen in o.a.…",€4.000 - €5.250 per maand
HP-Unix System Engineer,Leiden,SWIFT,Install software releases of common applications on all supported systems.Conduct problem investigation on HP-UX systems and application software to recommend…,
Senior Software Engineer - Data Streaming,Utrecht,Bol.com,"And because you are a great Java engineer with a proven track record with distributed systems, preferable data intensive applications.What are the pain points?",
Internship Machine Learning (Software) Engineer,Nederland,Sensys Gatso Group,We have several University level internships available in the field of machine vision and machine/deep learning to explore the possibilities to increase this…,
Cloud Tooling Engineer,Utrecht,Bol.com,"Therefore, we’re looking for a versatile engineer who’s proficient in both software development and system engineering.Why you can make a difference.",
Software Engineer,Eindhoven,Trifork,Daarom zoeken wij gedreven software engineers die in de voorhoede van de laatste trends willen werken.Bij ons innovatiebureau zijn we voortdurend bezig om…,
Software Engineer - New Grad (Amsterdam),Amsterdam,Databricks,"We are hiring software engineers who are passionate about architecting, developing, deploying, and operating the Databricks product.",
(Junior) Software Design Engineer,Gilze,EVS,"We are looking for an engineer responsible for the design, implementation, and testing of software applications.User interface design and scripting.",
Robotics engineer (ML/AI),Amsterdam,JetBrains,JetBrains is a globally operating IT vendor that provides tools and technologies for software developers.In late 2018 we decided to significantly expand our…,
Junior Software Engineer (32-40 hours/week),Leusden,Cablon Medical,Do you want to help hospitals worldwide meet high quality standard through cloud based software?Cablon Medical delivers all kinds of software and hardware to…,
Junior Software Engineer,Amsterdam Zuid,OPNT,"As a junior software engineer, you will be working on different programming tasks varying from.As an engineer at OPNT you will have a unique opportunity to…",
Java Software Engineer,Amsterdam,Adyen,As an engineer you will be responsible for the full development cycle from designing your software to testing and deploying it in a weekly release.,
PHP Software Engineer,Werk van thuis,Sandwave Software,Als onderdeel van marktleider Total Webhosting Solutions ontwikkelen we software producten voor de Europese cloud en hosting industrie welke dagelijks gebruikt…,€2.700 - €3.500 per maand
Software Engineer (NodeJS),Amsterdam,adidas,"API development Understanding of web software architectures - Client-server, Microservices, SOA Comfortable with DevOps concepts and usage of CI/CD tools.",
C++ Software Engineer,Amsterdam,IMC Financial Markets,As a software developer you’ll be working with traders and engineers to implement strategies that will challenge you to be creative with your implementation.,
Software Engineer (Junior),Veenendaal,CoachR Development,As a Software Engineer you will contribute to challenging software projects within a small team.We are looking forward to expand our team with enthusiastic…,
Software Engineer (Embedded + Golang + Python),Amsterdam Centrum,Hiber,"We control the complete chain of software in our system, from the firmware of the modems on the ground, to the satellite on board computers and the backend…",
(Junior) Software engineer,Vlaardingen,JB Systems,Als engineer bij JB Systems ben je bij het gehele project betrokken.Je bent al gewend of leert ‘on the job’ door mee te draaien in een projectteam met ervaren…,
Lead Software Engineer,Amsterdam Centrum,Cimpress/Vistaprint,"Coach and mentor junior engineers.Collaborate with the Lead Front End engineer and engineers in Boston, Amsterdam, and Bengaluru on a new JavaScript library of…",
Frontend Software Engineer,Amsterdam,Adyen,"Alongside Fintech's most experienced software developers, you will contribute to the interfaces of our fast-growing platform that processes billions of…",
Software Engineer E-plan Tekenaar,Ulft,Giesen Coffee Roasters,Je test de software op de koffiebranders.Wanneer de software in orde is zal deze op de koffiebranders worden geïnstalleerd.Hoe ziet jouw dag eruit?,
Quality Engineer,Eindhoven,Philips,3-5 years of relevant experience with IEC 62304 – medical device software – software life cycle processes.Familiarity in software development and testing for…,
Software Engineer,Nederland,EHW Groep,Als Software engineer ben je verantwoordelijk voor de projectgebonden software vanaf het (regeltechnische) ontwerp tot en met de inbedrijfstelling en nazorg.,
Software Test Engineer,Amsterdam Noord,Therapieland,"_If you have a passion for software testing and an interest in mental healthcare, this is your chance to combine the two professionally, as our Software Tester!…",
Software Engineer,Ede,innius,You will be a (senior) software engineer in the innius IoT cloud application team.Drive to deliver high quality software solutions.You will be a part of:,
Software Engineer,Amsterdam,Finaps,Passion for software and data.Within Finaps we work with small teams who are responsible for the client-interactions and for delivering sound software.,
